{"name":["pnpm"],"description":"Fast, disk space efficient package manager","subcommands":[{"name":["run","run-script"],"description":"Run a package.json script","options":[{"name":["--if-present"],"description":"Don't fail if the script is missing"},{"name":["--parallel"],"description":"Run in parallel"}],"args":[{"name":"script","generators":[{"script":["bash","-c","until [[ -f package.json ]] || [[ $PWD = '/' ]]; do cd ..; done; cat package.json"],"hasPostProcess":true,"hasCustom":false}]},{"name":"args","isOptional":true,"isVariadic":true}]},{"name":["install","i"],"description":"Install all dependencies","options":[{"name":["--frozen-lockfile"],"description":"Don't update the lockfile"},{"name":["-P","--prod"],"description":"Only production dependencies"},{"name":["--offline"],"description":"Use only the store"}]},{"name":["add"],"description":"Install a package","options":[{"name":["-D","--save-dev"],"description":"Save to devDependencies"},{"name":["-E","--save-exact"],"description":"Save an exact version"},{"name":["-g","--global"],"description":"Install globally"},{"name":["-w","--workspace-root"],"description":"Add to the workspace root"}],"args":[{"name":"package","isVariadic":true}]},{"name":["remove","rm","uninstall"],"description":"Remove a package","args":[{"name":"package","isVariadic":true}]},{"name":["update","up"],"description":"Update packages","options":[{"name":["-L","--latest"],"description":"Ignore the version range"}],"args":[{"name":"package","isOptional":true,"isVariadic":true}]},{"name":["test","t"],"description":"Run the test script"},{"name":["start"],"description":"Run the start script"},{"name":["exec"],"description":"Run a command in the package context","args":[{"name":"command","isCommand":true}]},{"name":["dlx"],"description":"Run a package without installing it","args":[{"name":"package"}]},{"name":["outdated"],"description":"Check for outdated packages"},{"name":["list","ls"],"description":"List installed packages"},{"name":["why"],"description":"Show why a package is installed","args":[{"name":"package"}]},{"name":["store"],"description":"Manage the package store","subcommands":[{"name":["prune"],"description":"Remove unreferenced packages"},{"name":["path"],"description":"Print the store path"}]},{"name":["publish"],"description":"Publish a package","isDangerous":true}],"options":[{"name":["-F","--filter"],"description":"Restrict to matching packages","args":[{"name":"selector"}],"isPersistent":true},{"name":["-r","--recursive"],"description":"Run in every workspace package","isPersistent":true},{"name":["-v","--version"],"description":"Show the pnpm version"},{"name":["-h","--help"],"description":"Show help"}],"args":[{"name":"script","isOptional":true,"generators":[{"script":["bash","-c","until [[ -f package.json ]] || [[ $PWD = '/' ]]; do cd ..; done; cat package.json"],"hasPostProcess":true,"hasCustom":false}]}]}