{"name":["kubectl"],"description":"Kubernetes command-line tool","subcommands":[{"name":["get"],"description":"Display one or many resources","options":[{"name":["-o","--output"],"description":"Output format","args":[{"name":"format","suggestions":[{"name":["json"]},{"name":["yaml"]},{"name":["wide"]},{"name":["name"]}]}]},{"name":["-l","--selector"],"description":"Label selector","args":[{"name":"selector"}]},{"name":["-w","--watch"],"description":"Watch for changes"}],"args":[{"name":"type","suggestions":[{"name":["pods"]},{"name":["deployments"]},{"name":["services"]},{"name":["nodes"]},{"name":["namespaces"]},{"name":["configmaps"]},{"name":["secrets"]},{"name":["ingresses"]},{"name":["jobs"]},{"name":["cronjobs"]},{"name":["statefulsets"]},{"name":["daemonsets"]},{"name":["replicasets"]},{"name":["persistentvolumeclaims"]},{"name":["events"]},{"name":["all"]}]},{"name":"name","isOptional":true,"isVariadic":true}]},{"name":["describe"],"description":"Show details of a resource","options":[{"name":["-l","--selector"],"description":"Label selector","args":[{"name":"selector"}]}],"args":[{"name":"type","suggestions":[{"name":["pods"]},{"name":["deployments"]},{"name":["services"]},{"name":["nodes"]},{"name":["namespaces"]},{"name":["configmaps"]},{"name":["secrets"]},{"name":["ingresses"]},{"name":["jobs"]},{"name":["cronjobs"]},{"name":["statefulsets"]},{"name":["daemonsets"]},{"name":["replicasets"]},{"name":["persistentvolumeclaims"]},{"name":["events"]},{"name":["all"]}]},{"name":"name","isOptional":true}]},{"name":["logs"],"description":"Print the logs for a container","options":[{"name":["-f","--follow"],"description":"Stream the logs"},{"name":["-c","--container"],"description":"Container name","args":[{"name":"container"}]},{"name":["--tail"],"description":"Lines of recent log","args":[{"name":"lines"}]},{"name":["-p","--previous"],"description":"Previous container instance"}],"args":[{"name":"pod"}]},{"name":["apply"],"description":"Apply a configuration to a resource","options":[{"name":["-f","--filename"],"description":"File or directory with the resources","args":[{"name":"file","template":["filepaths"]}],"isRepeatable":true},{"name":["-k","--kustomize"],"description":"Kustomization directory","args":[{"name":"dir","template":["folders"]}]},{"name":["--dry-run"],"description":"Only print the object","args":[{"name":"mode","suggestions":[{"name":["none"]},{"name":["client"]},{"name":["server"]}]}],"requiresSeparator":true}]},{"name":["delete"],"description":"Delete resources","isDangerous":true,"options":[{"name":["-f","--filename"],"description":"File or directory with the resources","args":[{"name":"file","template":["filepaths"]}],"isRepeatable":true},{"name":["-l","--selector"],"description":"Label selector","args":[{"name":"selector"}]},{"name":["--all"],"description":"Delete all resources of the type","isDangerous":true},{"name":["--force"],"description":"Immediately remove resources","isDangerous":true}],"args":[{"name":"type","suggestions":[{"name":["pods"]},{"name":["deployments"]},{"name":["services"]},{"name":["nodes"]},{"name":["namespaces"]},{"name":["configmaps"]},{"name":["secrets"]},{"name":["ingresses"]},{"name":["jobs"]},{"name":["cronjobs"]},{"name":["statefulsets"]},{"name":["daemonsets"]},{"name":["replicasets"]},{"name":["persistentvolumeclaims"]},{"name":["events"]},{"name":["all"]}]},{"name":"name","isOptional":true,"isVariadic":true}]},{"name":["exec"],"description":"Execute a command in a container","options":[{"name":["-i","--stdin"],"description":"Pass stdin"},{"name":["-t","--tty"],"description":"Allocate a TTY"},{"name":["-c","--container"],"description":"Container name","args":[{"name":"container"}]}],"args":[{"name":"pod"},{"name":"command","isOptional":true,"isCommand":true}]},{"name":["port-forward"],"description":"Forward local ports to a pod","args":[{"name":"pod"},{"name":"ports","isVariadic":true}]},{"name":["rollout"],"description":"Manage the rollout of a resource","subcommands":[{"name":["status"],"description":"Show rollout status","args":[{"name":"resource"}]},{"name":["restart"],"description":"Restart a resource","args":[{"name":"resource"}]},{"name":["undo"],"description":"Undo a previous rollout","args":[{"name":"resource"}]},{"name":["history"],"description":"View rollout history","args":[{"name":"resource"}]}]},{"name":["scale"],"description":"Set a new size for a deployment","options":[{"name":["--replicas"],"description":"New desired number of replicas","args":[{"name":"count"}],"requiresSeparator":true}],"args":[{"name":"resource"}]},{"name":["config"],"description":"Modify kubeconfig files","subcommands":[{"name":["use-context"],"description":"Set the current context","args":[{"name":"context","generators":[{"script":["kubectl","config","get-contexts","-o","name"],"hasPostProcess":true,"hasCustom":false}]}]},{"name":["current-context"],"description":"Display the current context"},{"name":["get-contexts"],"description":"Describe one or many contexts"},{"name":["set-context"],"description":"Set a context entry","options":[{"name":["--current"],"description":"Modify the current context"},{"name":["--namespace"],"description":"Namespace","args":[{"name":"namespace"}],"requiresSeparator":true}],"args":[{"name":"context","isOptional":true,"generators":[{"script":["kubectl","config","get-contexts","-o","name"],"hasPostProcess":true,"hasCustom":false}]}]},{"name":["view"],"description":"Display merged kubeconfig settings","options":[{"name":["--minify"],"description":"Only the current context"}]}]},{"name":["create"],"description":"Create a resource from a file or stdin","options":[{"name":["-f","--filename"],"description":"File or directory with the resources","args":[{"name":"file","template":["filepaths"]}],"isRepeatable":true}]},{"name":["edit"],"description":"Edit a resource on the server","args":[{"name":"type","suggestions":[{"name":["pods"]},{"name":["deployments"]},{"name":["services"]},{"name":["nodes"]},{"name":["namespaces"]},{"name":["configmaps"]},{"name":["secrets"]},{"name":["ingresses"]},{"name":["jobs"]},{"name":["cronjobs"]},{"name":["statefulsets"]},{"name":["daemonsets"]},{"name":["replicasets"]},{"name":["persistentvolumeclaims"]},{"name":["events"]},{"name":["all"]}]},{"name":"name"}]},{"name":["top"],"description":"Display resource usage","subcommands":[{"name":["pod"],"description":"Pod usage"},{"name":["node"],"description":"Node usage"}]}],"options":[{"name":["-n","--namespace"],"description":"Namespace scope for the request","args":[{"name":"namespace"}],"isPersistent":true},{"name":["--context"],"description":"Kubeconfig context to use","args":[{"name":"context","generators":[{"script":["kubectl","config","get-contexts","-o","name"],"hasPostProcess":true,"hasCustom":false}]}],"isPersistent":true},{"name":["-A","--all-namespaces"],"description":"List across all namespaces","isPersistent":true},{"name":["--help"],"description":"Show help"}]}